{
  "url": "https://test.test/test/2",
  "title": "This a test document - DOC2 - attachment",
  "source": [1503],
  "country": [13, 14],
  "format": [10],
  "language": [267, 268],
  "published": "2024-06-06T01:00:00+00:00",
  "body": "This is the **body** text in markdown format.\n\nIt has some paragraphs  \nand a line break.<h1>TITLE</h1><p>pouet <strong>parag</strong></p><ul><li>dsdf</li><li>sdfgsdgf</li></ul><p>sdfgs <a href=\"https://bidule.com\">Bidule</a></p>",
  "embargoed": "2024-06-06T07:00:00+00:00",
  "file": [
    {
      "url": "https://reliefweb.int/attachments/a2e0b418-1aef-4e63-9cd2-6277a29d6ccf/test-01.pdf",
      "checksum": "0fc1dd7bae056baf7fff962117363e1f",
      "description": "First attachment",
      "language": "en"
    }
  ],
  "disaster": [51754],
  "disaster_type": [4628],
  "theme": [4587, 4595, 4603],
  "origin": "https://test.test/test/2"
}
